{
  "schemaVersion": 1,
  "appId": "com.singularitysolutions.vrcmediaserver.quest",
  "displayName": "Halo",
  "buildVersion": "0.4.2",
  "apkPath": "payloads/current/Halo.apk",
  "targetPlatforms": ["quest"],
  "installPolicy": "ReinstallAllowDowngrade",
  "grantPermissions": true,
  "allowTestApk": true,
  "launchAfterInstall": false,
  "preferredDeviceFamilies": ["meta-quest-2", "meta-quest-3"],
  "postInstallNotes": {
    "quest": [
      "Open Library.",
      "Open the filter menu.",
      "Select Unknown Sources.",
      "Launch Halo."
    ],
    "android": [
      "Halo is a Quest app. Connect a headset to install it."
    ]
  },
  "support": {
    "contactLabel": "Send diagnostics to support",
    "contactEmail": "support@example.com"
  }
}
